{
  "schemaVersion": 2,
  "generatedAt": "2026-10-16T05:07:34+00:00",
  "validUntil": "2026-10-23T05:07:34+00:00",
  "source": "https://www.harzer-wandernadel.de/defektmeldungen/",
  "sourceSha256": "2f3d0396a2481a511a678e6fece61fa49dde993566fc489eb32ba061bb96cffb",
  "extractSha256": "9328372ed28cfc40d44fe46b18797d88930962d19f09c7f57663722e08ef4ef3",
  "defects": [
    {
      "id": "75a9006dbdb0",
      "severity": "warning",
      "station": 31,
      "name": "Agnesberg"
    },
    {
      "id": "4b8a5da0dfe0",
      "severity": "warning",
      "station": 23,
      "name": "Molkenhausstern"
    },
    {
      "id": "a5fa6b6443a9",
      "severity": "warning",
      "station": 32,
      "name": "Gasth. Christianental"
    },
    {
      "id": "a5b5d4c38eac",
      "severity": "warning",
      "station": 45,
      "name": "Dicke Tannen"
    },
    {
      "id": "a801ac730ca6",
      "severity": "warning",
      "station": 94,
      "name": "Dreiherrenstein (am Brandhai 48A)"
    },
    {
      "id": "151c30f59a6f",
      "severity": "warning",
      "station": 114,
      "name": "Ramseck"
    },
    {
      "id": "d15b49af2080",
      "severity": "warning",
      "station": 140,
      "name": "Eselsplatz"
    },
    {
      "id": "9f8e8f64a6d7",
      "severity": "warning",
      "station": 150,
      "name": "Großer Knollen"
    },
    {
      "id": "a07b5b3bdc1c",
      "severity": "warning",
      "station": 192,
      "name": "Historischer Gipsbrennofen"
    }
  ],
  "notices": [
    {
      "id": "12e85595d773",
      "severity": "info",
      "station": 149,
      "text": "ACHTUNG! Ab 1. Januar 2025 versetzen wir unsere numerische Stempelstelle Nummer 149 vom aktuellen Standort „Kleine Oker“ zum neuen Standort „Mühlenberg Altenauer Herzweg“ N51.803286 E 10.450144"
    },
    {
      "id": "6c77f1668ef1",
      "severity": "info",
      "station": 163,
      "text": "Die Stempelstelle 163 Bremerklippe wurde 2,7 Kilometer entfernt an den Kaiserweg versetzt."
    },
    {
      "id": "6b4291d81c11",
      "severity": "info",
      "station": 43,
      "text": "Bei der Stempelstelle 43 Hohe Tür – Wasserscheide Weser-Elbe ist der Wanderweg um die Steinatalsperre gesperrt! Wanderer sollten den gegenüber der Steinatalsperre liegenden Weg als Ausweichroute wählen"
    },
    {
      "id": "35b0a71f461a",
      "severity": "info",
      "station": 99,
      "text": "Die Stempelstelle HWN 99 Hörninger Sattelköpfe wurde aufgrund von ständigen Sachbeschädigungen dauerhaft zur Harzer Holzdampflok oberhalb von Neustadt/Harz versetzt."
    },
    {
      "id": "f477a6ae5b17",
      "severity": "info",
      "station": 141,
      "text": "Die Stempelstelle HWN 141 Lasfelder Tränke wurde dauerhaft an den Oberen Hahnebalzer Teich an den Harzer Baudensteig versetzt."
    },
    {
      "id": "85b1cd8e7bd2",
      "severity": "info",
      "station": 91,
      "text": "Zutritt zum HWN 91 Weltkulturerbe Rammelsberg täglich 9:00 Uhr bis 17:00 Uhr."
    },
    {
      "id": "f8f77092b06b",
      "severity": "info",
      "station": 146,
      "text": "Die Stempelstelle 146 – Großes Wehr ist ab Parkplatz Stieglitzecke aufgrund der Gefahr von Todholzabbruch nicht zu erreichen. Ein guter Ausgangspunkt ist das Sperberhaier Dammhaus über den Dammgraben."
    }
  ],
  "closures": [
    {
      "id": "7014ad7d4d83",
      "severity": "critical",
      "title": "Oder Minigolf"
    },
    {
      "id": "6dc5f61adfaf",
      "severity": "critical",
      "title": "Brandberg"
    },
    {
      "id": "fc1f7c651d2c",
      "severity": "critical",
      "title": "Talsperre Kelbra"
    },
    {
      "id": "28a940d7bf6d",
      "severity": "critical",
      "title": "Rund um Quedlinburg – Aholzwarte (entfällt vorläufig!)"
    },
    {
      "id": "12126ada2d96",
      "severity": "critical",
      "title": "Jubiläumsheft – Bückeberg entfällt!"
    },
    {
      "id": "0182ea8405c1",
      "severity": "critical",
      "title": "Karstwanderweg – Papenberg entfällt!"
    },
    {
      "id": "5ee7a6edfe63",
      "severity": "critical",
      "title": "Aufgrund der Bauarbeiten am Schloss Wernigerode wurde der Stempelkasten vor das untere Schlosstor versetzt."
    },
    {
      "id": "2a51cda927dd",
      "severity": "critical",
      "title": "Der Sonderstempel zum Klosterwanderweg am Kloster Michaelstein befindet sich an der Hauswand zwischen dem Waschhaus und der Musikscheune."
    },
    {
      "id": "93d6915a4b4d",
      "severity": "critical",
      "title": "Die Aholzwarte in Quedlinburg entfällt zukünftig für das Themenheft „Rund um Bad Suderode, Gernrode und die Welterbestadt Quedlinburg“"
    },
    {
      "id": "5307e4c55aa2",
      "severity": "critical",
      "title": "Der Jubiläumstempel „Butterkuppe“ wurde versetzt und befindet sich in einer Schutzhütte auf dem Kaiser-Otto-Höhenweg in Richtung Wallhausen"
    }
  ]
}
